<?xml version="1.0" encoding="UTF-8" ?>
<!DOCTYPE op4_xml [
        <!ELEMENT op4_xml (entry)*>
        <!ELEMENT entry (title,description,date,salary)>
        <!ATTLIST entry
                id CDATA #REQUIRED>
        <!ELEMENT title (#PCDATA)>
        <!ELEMENT description (#PCDATA)>
        <!ELEMENT date (#PCDATA)>
        <!ELEMENT salary (#PCDATA)>
        <!ATTLIST salary
                currency CDATA #REQUIRED>
        ]>
<op4_xml>
    <!-- Im Wurzel-Element können beliebig viele andere Elemente enthalten sein -->
    <entry id="01"> <!-- Elemente können Attribute besitzen -->
        <title>Meine Erste XML Node</title> <!-- Elemente enthalten entweder andere Elemente oder Text-Content -->
        <description>Irgend eine Beschreibung</description>
        <date>2022-07-22</date>
        <salary currency="EUR">5000</salary>
    </entry>
    <entry id="02">
        <title>Meine Zweite XML Node</title>
        <description>Irgend eine andere Beschreibung</description>
        <date>2022-07-20</date>
        <salary currency="EUR">50000</salary>
    </entry>
    <entry id="03">
        <title>Meine Dritte XML Node</title>
        <description>Eine weitere Beschreibung</description>
        <date>2021-07-02</date>
        <salary currency="USD">500000</salary>
    </entry>
</op4_xml>